{
  "schema_version": "market-analysis-context-v1",
  "context_id": "ctx_eth_golden_breakout_v1",
  "instrument": "ETH-USDT-SWAP",
  "generated_at": "2026-01-15T12:00:00Z",
  "decision_time": "2026-01-15T12:00:00Z",
  "latest_confirmed_market_time": "2026-01-15T11:45:00Z",
  "requested_analysis_mode": "FULL",
  "source_versions": {
    "candles": "fixture-ohlcv-v1",
    "flow": "fixture-flow-v1",
    "structure": "fixture-structure-v1"
  },
  "data_watermarks": {
    "candles": "2026-01-15T11:45:00Z",
    "cvd": "2026-01-15T11:59:00Z",
    "oi": "2026-01-15T11:59:00Z"
  },
  "data_quality": {
    "overall": "VALID",
    "gaps": [],
    "stale_sources": [],
    "missing_sources": [],
    "watermark_mismatches": []
  },
  "timeframe_structures": [
    {
      "timeframe": "15m",
      "last_confirmed_close": {
        "value": 1902,
        "unit": "USDT",
        "timestamp": "2026-01-15T12:00:00Z",
        "source": "fixture",
        "status": "DERIVED",
        "quality": "VALID",
        "derivation": "static golden fixture; not live market data",
        "version": "fixture-v1"
      },
      "current_incomplete_candle": {
        "open_time": "2026-01-15T12:00:00Z",
        "confirmed": false
      },
      "moving_averages": {
        "ma20": {
          "value": 1897,
          "unit": "USDT",
          "timestamp": "2026-01-15T12:00:00Z",
          "source": "fixture",
          "status": "DERIVED",
          "quality": "VALID",
          "derivation": "static golden fixture; not live market data",
          "version": "fixture-v1"
        },
        "ma30": {
          "value": 1893,
          "unit": "USDT",
          "timestamp": "2026-01-15T12:00:00Z",
          "source": "fixture",
          "status": "DERIVED",
          "quality": "VALID",
          "derivation": "static golden fixture; not live market data",
          "version": "fixture-v1"
        },
        "ma60": {
          "value": 1884,
          "unit": "USDT",
          "timestamp": "2026-01-15T12:00:00Z",
          "source": "fixture",
          "status": "DERIVED",
          "quality": "VALID",
          "derivation": "static golden fixture; not live market data",
          "version": "fixture-v1"
        },
        "ma200": {
          "value": 1862,
          "unit": "USDT",
          "timestamp": "2026-01-15T12:00:00Z",
          "source": "fixture",
          "status": "DERIVED",
          "quality": "VALID",
          "derivation": "static golden fixture; not live market data",
          "version": "fixture-v1"
        },
        "ema20": {
          "value": 1898,
          "unit": "USDT",
          "timestamp": "2026-01-15T12:00:00Z",
          "source": "fixture",
          "status": "DERIVED",
          "quality": "VALID",
          "derivation": "static golden fixture; not live market data",
          "version": "fixture-v1"
        }
      },
      "slopes": {
        "ema20": {
          "value": -0.2,
          "unit": "percent/4bars",
          "timestamp": "2026-01-15T12:00:00Z",
          "source": "fixture",
          "status": "DERIVED",
          "quality": "VALID",
          "derivation": "static golden fixture; not live market data",
          "version": "fixture-v1"
        }
      },
      "price_position": "ABOVE_SHORT_MA",
      "moving_average_ordering": "MIXED",
      "swing_structure": "MIXED",
      "rsi": {
        "value": 48,
        "unit": "index",
        "timestamp": "2026-01-15T12:00:00Z",
        "source": "fixture",
        "status": "DERIVED",
        "quality": "VALID",
        "derivation": "static golden fixture; not live market data",
        "version": "fixture-v1"
      },
      "stoch_rsi": {
        "value": 55,
        "unit": "index",
        "timestamp": "2026-01-15T12:00:00Z",
        "source": "fixture",
        "status": "DERIVED",
        "quality": "VALID",
        "derivation": "static golden fixture; not live market data",
        "version": "fixture-v1"
      },
      "atr": {
        "value": 11,
        "unit": "USDT",
        "timestamp": "2026-01-15T12:00:00Z",
        "source": "fixture",
        "status": "DERIVED",
        "quality": "VALID",
        "derivation": "static golden fixture; not live market data",
        "version": "fixture-v1"
      },
      "volume_regime": "CONTRACTION",
      "trend_classification": "TRANSITION_UP",
      "structure_classification": "POST_BREAKOUT_PULLBACK",
      "nearest_support": "/key_levels/0",
      "nearest_resistance": "/key_levels/1",
      "invalidation": {
        "rule": "confirmed close below 1885 invalidates the breakout hold",
        "evidence_paths": [
          "/key_levels/0"
        ]
      },
      "confidence": "MEDIUM",
      "supporting_facts": [
        {
          "claim": "confirmed close retains breakout area",
          "evidence_paths": [
            "/market_timeline/range_high"
          ]
        }
      ],
      "contradicting_facts": [
        {
          "claim": "pullback momentum is incomplete",
          "evidence_paths": [
            "/timeframe_structures/0/stoch_rsi"
          ]
        }
      ],
      "source_bar_timestamps": [
        "2026-01-15T11:45:00Z"
      ]
    },
    {
      "timeframe": "1H",
      "last_confirmed_close": {
        "value": 1902,
        "unit": "USDT",
        "timestamp": "2026-01-15T12:00:00Z",
        "source": "fixture",
        "status": "DERIVED",
        "quality": "VALID",
        "derivation": "static golden fixture; not live market data",
        "version": "fixture-v1"
      },
      "current_incomplete_candle": {
        "open_time": "2026-01-15T12:00:00Z",
        "confirmed": false
      },
      "moving_averages": {
        "ma20": {
          "value": 1897,
          "unit": "USDT",
          "timestamp": "2026-01-15T12:00:00Z",
          "source": "fixture",
          "status": "DERIVED",
          "quality": "VALID",
          "derivation": "static golden fixture; not live market data",
          "version": "fixture-v1"
        },
        "ma30": {
          "value": 1893,
          "unit": "USDT",
          "timestamp": "2026-01-15T12:00:00Z",
          "source": "fixture",
          "status": "DERIVED",
          "quality": "VALID",
          "derivation": "static golden fixture; not live market data",
          "version": "fixture-v1"
        },
        "ma60": {
          "value": 1884,
          "unit": "USDT",
          "timestamp": "2026-01-15T12:00:00Z",
          "source": "fixture",
          "status": "DERIVED",
          "quality": "VALID",
          "derivation": "static golden fixture; not live market data",
          "version": "fixture-v1"
        },
        "ma200": {
          "value": 1862,
          "unit": "USDT",
          "timestamp": "2026-01-15T12:00:00Z",
          "source": "fixture",
          "status": "DERIVED",
          "quality": "VALID",
          "derivation": "static golden fixture; not live market data",
          "version": "fixture-v1"
        },
        "ema20": {
          "value": 1898,
          "unit": "USDT",
          "timestamp": "2026-01-15T12:00:00Z",
          "source": "fixture",
          "status": "DERIVED",
          "quality": "VALID",
          "derivation": "static golden fixture; not live market data",
          "version": "fixture-v1"
        }
      },
      "slopes": {
        "ema20": {
          "value": 0.8,
          "unit": "percent/4bars",
          "timestamp": "2026-01-15T12:00:00Z",
          "source": "fixture",
          "status": "DERIVED",
          "quality": "VALID",
          "derivation": "static golden fixture; not live market data",
          "version": "fixture-v1"
        }
      },
      "price_position": "ABOVE_SHORT_MA",
      "moving_average_ordering": "EMA20_GT_MA30_GT_MA60",
      "swing_structure": "HH_HL",
      "rsi": {
        "value": 62,
        "unit": "index",
        "timestamp": "2026-01-15T12:00:00Z",
        "source": "fixture",
        "status": "DERIVED",
        "quality": "VALID",
        "derivation": "static golden fixture; not live market data",
        "version": "fixture-v1"
      },
      "stoch_rsi": {
        "value": 55,
        "unit": "index",
        "timestamp": "2026-01-15T12:00:00Z",
        "source": "fixture",
        "status": "DERIVED",
        "quality": "VALID",
        "derivation": "static golden fixture; not live market data",
        "version": "fixture-v1"
      },
      "atr": {
        "value": 35,
        "unit": "USDT",
        "timestamp": "2026-01-15T12:00:00Z",
        "source": "fixture",
        "status": "DERIVED",
        "quality": "VALID",
        "derivation": "static golden fixture; not live market data",
        "version": "fixture-v1"
      },
      "volume_regime": "NORMAL",
      "trend_classification": "UP",
      "structure_classification": "BREAKOUT_CONFIRMED",
      "nearest_support": "/key_levels/0",
      "nearest_resistance": "/key_levels/1",
      "invalidation": {
        "rule": "confirmed close below 1885 invalidates the breakout hold",
        "evidence_paths": [
          "/key_levels/0"
        ]
      },
      "confidence": "MEDIUM",
      "supporting_facts": [
        {
          "claim": "confirmed close retains breakout area",
          "evidence_paths": [
            "/market_timeline/range_high"
          ]
        }
      ],
      "contradicting_facts": [
        {
          "claim": "pullback momentum is incomplete",
          "evidence_paths": [
            "/timeframe_structures/0/stoch_rsi"
          ]
        }
      ],
      "source_bar_timestamps": [
        "2026-01-15T11:45:00Z"
      ]
    },
    {
      "timeframe": "4H",
      "last_confirmed_close": {
        "value": 1902,
        "unit": "USDT",
        "timestamp": "2026-01-15T12:00:00Z",
        "source": "fixture",
        "status": "DERIVED",
        "quality": "VALID",
        "derivation": "static golden fixture; not live market data",
        "version": "fixture-v1"
      },